review_id	review_text	aspect_term	polarity
1732	the only thing that i do n't  like about my mac is that sometimes there are programs that i want to be able to run and i am not able to . 	programs	1
1063	wireless has not been a issue for me ,  like some others have meantioned . 	wireless	0
271	macbook notebooks quickly die out because of their short battery life ,  as well as the many background programs that run without the user 's  knowlede . 	battery life	1
271	macbook notebooks quickly die out because of their short battery life ,  as well as the many background programs that run without the user 's  knowlede . 	programs	1
2478	all the things you can do with the trackpad make navigating around the computer and its programs so much simpler ,  quicker ,  and easier . 	trackpad	0
2478	all the things you can do with the trackpad make navigating around the computer and its programs so much simpler ,  quicker ,  and easier . 	programs	0
2478	all the things you can do with the trackpad make navigating around the computer and its programs so much simpler ,  quicker ,  and easier . 	navigating	0
523	i guess the only good thing that came out of these were the speakers and the subwoofer . 	speakers	0
523	i guess the only good thing that came out of these were the speakers and the subwoofer . 	subwoofer	0
1657	theres a built in camera with special effects -  for video and photography . 	built in camera	0
1674	all for such a great price . 	price	0
1143	long story short ,  since i experience so many problems with my laptop every since i bought it from day one ,  i did n't  ask for a new laptop or a refund of what i pay for a crapy laptop ,  but just an extension of my laptop warranty for another year ,  they made a big deal of out that and after so many calls and complaints about their products and services ,  they finally gave in . 	warranty	2
2927	another thing is that after only a month the left mouse key broke and it costed $175 to send it in to fix it . 	left mouse key	1
2927	another thing is that after only a month the left mouse key broke and it costed $175 to send it in to fix it . 	costed	2
2993	it has good speed and plenty of hard drive space . 	speed	0
2993	it has good speed and plenty of hard drive space . 	hard drive space	0
2453	clear picture on it and everything . 	picture	0
515	they said that my computer was covered on an extended warranty ,  and that products with extended warranties are taken care of through third parties and not sony itself anymore . 	extended warranty	2
515	they said that my computer was covered on an extended warranty ,  and that products with extended warranties are taken care of through third parties and not sony itself anymore . 	extended warranties	2
2572	very long - life battery  ( up to 10 - 11 hours depending on how you configure power level settings )  . 	battery	0
2387	screen is awesome ,  battery life is good . 	screen	0
2387	screen is awesome ,  battery life is good . 	battery life	0
2517	the black model also has a very nice seamless appearance  -  one of the better looking notebooks i 've  seen . 	appearance	0
990	the technical service for dell is so 3rd world it might as well not even bother . 	technical service for dell	1
1414	the graphics were awful and the warranty is n't  even worth the cheap payment on the computer . 	graphics	1
1414	the graphics were awful and the warranty is n't  even worth the cheap payment on the computer . 	warranty	1
903	they gave me a hard time yet again ,  but their was a malfunction in the battery itself ,  it did n't  die . 	battery	1
1602	if you do n't  feel comfortable doing it yourself ,  just buy the case and be happy ,  plus it looks nice ,  i bought the white one from best buy . 	case	0
2231	you can find many laptops with the same performance and even better with lower price ,  but you cannot find the look ,  easy ,  applications ,  and the experience in mac . 	performance	2
2231	you can find many laptops with the same performance and even better with lower price ,  but you cannot find the look ,  easy ,  applications ,  and the experience in mac . 	price	0
2231	you can find many laptops with the same performance and even better with lower price ,  but you cannot find the look ,  easy ,  applications ,  and the experience in mac . 	look	0
2231	you can find many laptops with the same performance and even better with lower price ,  but you cannot find the look ,  easy ,  applications ,  and the experience in mac . 	applications	0
2828	excellent speed for processing data . 	speed	0
1824	when you call tech support you were routed to someone who was in another country and did not know what they were doing . 	tech support	1
2460	it has come into good use for my finances ,  scheduling ,  my parents business expenses ,  and it is definitely amazing for gaming . 	gaming	0
2460	it has come into good use for my finances ,  scheduling ,  my parents business expenses ,  and it is definitely amazing for gaming . 	use	0
2500	i was taught to use photoshop and was amazed . 	photoshop	0
677	4gb of ram .  .  . 	ram	2
1252	somehow the system clock got messed up after reboot . 	system clock	1
3007	the only problem is that i had to add 1 gb ram ,  the computer was kinda slow . 	ram	1
1650	with the macbook pro it comes with freesecuritysoftware to protect it from viruses and other intrusive things from downloads and internet surfing or emails . 	securitysoftware	0
1037	the driver updates do n't  fix the issue ,  very frustrating . 	driver updates	1
1620	i will never go back to windows ! 	windows	1
285	it doesnt work worth a damn . 	work	1
3035	it works really well . 	works	0
2511	bigger hd ,  better graphics card ,  and a bid hd . 	hd	0
2511	bigger hd ,  better graphics card ,  and a bid hd . 	hd	0
2511	bigger hd ,  better graphics card ,  and a bid hd . 	graphics card	0
2275	the built in camera is very useful when chatting with other techs in remote buildings on our campus . 	built in camera	0
1124	mine came at $1 , 700 w / o a dvd burner  (  !  )  . 	dvd burner	1
781	the dvd burner broke after burning 3 dvd 'd  during that time ! 	dvd burner	1
2987	it works fine with our wireless and they 've  had not problems . 	works	0
2133	but you must get the 15 inch . 	15 inch	0
1364	product support very poor as each phone call costs me long distan	product support	1
2787	overall the computer is very easy to use ,  the screen is perfect ,  great computer ,  my daughter loves . 	screen	0
2787	overall the computer is very easy to use ,  the screen is perfect ,  great computer ,  my daughter loves . 	use	0
948	the casing of the power cord fried and shocked my husband when he pulled it out of the socket . 	casing of the power cord	1
2049	it does not keep internet signals no matter where you bring it . 	internet signals	1
2988	it 's  a great product for a great price ! 	price	0
1385	again ,  the same problem ,  the right speaker did not work . 	right speaker	1
1646	but see the macbook pro is different because it may have a huge price tag but it comes with the full software that you would actually need and most of it has free future updates . 	software	0
1646	but see the macbook pro is different because it may have a huge price tag but it comes with the full software that you would actually need and most of it has free future updates . 	updates	0
2505	and the multiple page viewer  (  allows you to press one button to see every separate page currently opened at the same time in one screen )  are great for those who are working non stop or just shopping online . 	multiple page viewer	0
768	this was the 3rd day and part still had not been shipped . 	shipped	1
214	keyboard good sized and wasy to use . 	keyboard	0
214	keyboard good sized and wasy to use . 	use	0
1263	hp said it was out of warranty . 	warranty	2
142	i never had this kind of quality issue with dell  ( not to say dell is that great )  ,  not with a brand new laptop . 	quality	1
2947	wonderful features . 	features	0
2020	i had to call hp and ask for a recovery disk because the computer does not come with one and completely redo it all . 	recovery disk	1
2451	im glad that it has such great features in it . 	features	0
314	i like those programs better than office and you can save your files to be completely compatible with the office programs as well . 	programs	0
314	i like those programs better than office and you can save your files to be completely compatible with the office programs as well . 	office	1
314	i like those programs better than office and you can save your files to be completely compatible with the office programs as well . 	office programs	2
2777	great wifi too . 	wifi	0
1085	when typing ,  letters and spaces are frequently omitted requiring the user to redo many words and sentences . 	typing	1
1906	only a few days after i received the computer back ,  the screen froze again . 	screen	1
124	it is not ideal for children because of the temp . 	temp	1
732	although i do believe that windows operating system may be to fault for some of the problems . 	windows operating system	1
3011	great os ,  fabulous improvements to the existing line bumping up the processor speed and adding the thunderbolt port . 	os	0
3011	great os ,  fabulous improvements to the existing line bumping up the processor speed and adding the thunderbolt port . 	processor speed	0
3011	great os ,  fabulous improvements to the existing line bumping up the processor speed and adding the thunderbolt port . 	thunderbolt port	0
1842	the lcd screen stopped working on mine after 10 months . 	lcd screen	1
205	images are crisp and clean . 	images	0
1398	although its windows vista compared to windows xp sucks . 	windows vista	1
1398	although its windows vista compared to windows xp sucks . 	windows xp	0
1372	we have had numerous problems with vista ,  such as adobe flash player just quits and has to be uninstalled and then reinsalled ,  internet explore just quits and you lose whatever you were working on ,  also ,  the same windows update has appeared on this computer since we got it and has been updated probably 400 times ,  the same update . 	vista	1
1372	we have had numerous problems with vista ,  such as adobe flash player just quits and has to be uninstalled and then reinsalled ,  internet explore just quits and you lose whatever you were working on ,  also ,  the same windows update has appeared on this computer since we got it and has been updated probably 400 times ,  the same update . 	adobe flash player	1
1372	we have had numerous problems with vista ,  such as adobe flash player just quits and has to be uninstalled and then reinsalled ,  internet explore just quits and you lose whatever you were working on ,  also ,  the same windows update has appeared on this computer since we got it and has been updated probably 400 times ,  the same update . 	internet explore	1
1372	we have had numerous problems with vista ,  such as adobe flash player just quits and has to be uninstalled and then reinsalled ,  internet explore just quits and you lose whatever you were working on ,  also ,  the same windows update has appeared on this computer since we got it and has been updated probably 400 times ,  the same update . 	windows update	1
1372	we have had numerous problems with vista ,  such as adobe flash player just quits and has to be uninstalled and then reinsalled ,  internet explore just quits and you lose whatever you were working on ,  also ,  the same windows update has appeared on this computer since we got it and has been updated probably 400 times ,  the same update . 	update	1
1400	with the switch being at the top you need to memorize the key combination rather than just flicking a switch . 	switch	1
1400	with the switch being at the top you need to memorize the key combination rather than just flicking a switch . 	switch	1
1066	one more tip ,  please purchase this model and get a 4gb stick of ram to save you $10	4gb stick of ram	0
344	it has bein into the shop to get a new hardrive 2 times and to fix the touch control buttons on the keyboard ! 	hardrive	1
344	it has bein into the shop to get a new hardrive 2 times and to fix the touch control buttons on the keyboard ! 	touch control buttons	1
344	it has bein into the shop to get a new hardrive 2 times and to fix the touch control buttons on the keyboard ! 	keyboard	1
2871	i always have used a tower home pc and jumped to the laptop and have been very satisfied with its performance . 	performance	0
312	the computer runs very fast with no problems and the ilife software that comes with it  ( iphoto ,  imovie ,  iweb ,  itunes ,  garageband )  is all very helpful as well . 	ilife software	0
312	the computer runs very fast with no problems and the ilife software that comes with it  ( iphoto ,  imovie ,  iweb ,  itunes ,  garageband )  is all very helpful as well . 	iphoto	0
312	the computer runs very fast with no problems and the ilife software that comes with it  ( iphoto ,  imovie ,  iweb ,  itunes ,  garageband )  is all very helpful as well . 	imovie	0
312	the computer runs very fast with no problems and the ilife software that comes with it  ( iphoto ,  imovie ,  iweb ,  itunes ,  garageband )  is all very helpful as well . 	iweb	0
312	the computer runs very fast with no problems and the ilife software that comes with it  ( iphoto ,  imovie ,  iweb ,  itunes ,  garageband )  is all very helpful as well . 	itunes	0
312	the computer runs very fast with no problems and the ilife software that comes with it  ( iphoto ,  imovie ,  iweb ,  itunes ,  garageband )  is all very helpful as well . 	garageband	0
312	the computer runs very fast with no problems and the ilife software that comes with it  ( iphoto ,  imovie ,  iweb ,  itunes ,  garageband )  is all very helpful as well . 	runs	0
2795	at first it worked well for a month or so then the system board failed and i send it in to toshiba some complaints and three weeks later i then receive my laptop back only to discover that it still has the same problem so now i have to send it back again to get it fixed again . 	system board	1
1865	until i bought the dell ,  i thought you just looked for what you wanted  ( size ,  software ,  options ,  hardware )  and purchase the best deal you could find . 	size	2
1865	until i bought the dell ,  i thought you just looked for what you wanted  ( size ,  software ,  options ,  hardware )  and purchase the best deal you could find . 	software	2
1865	until i bought the dell ,  i thought you just looked for what you wanted  ( size ,  software ,  options ,  hardware )  and purchase the best deal you could find . 	hardware	2
2973	it has plenty of memory ,  lots of hard drive ,  and great graphics . 	memory	0
2973	it has plenty of memory ,  lots of hard drive ,  and great graphics . 	hard drive	0
2973	it has plenty of memory ,  lots of hard drive ,  and great graphics . 	graphics	0
2612	it did n't  take me long to get switched over to the mac computer programs and navigation  -  it 's  been just fine and like the way this laptop functions much better . 	programs	0
2612	it did n't  take me long to get switched over to the mac computer programs and navigation  -  it 's  been just fine and like the way this laptop functions much better . 	navigation	0
1283	however ,  my girlfriend realized that the netbook 's  hinge is a bit loose  ( when you open or close the lcd )  . 	hinge	1
1283	however ,  my girlfriend realized that the netbook 's  hinge is a bit loose  ( when you open or close the lcd )  . 	lcd	2
1423	my problem was with dell customer service . 	dell customer service	1
1072	newegg 's  rma service was great as always ,  i contacted them late friday night ,  and they issued me an rma number and a prepaid ups shipping label the very next morning on saturday . 	rma service	0
1739	design :  very durable . 	design	0
2419	it is easy to go from one keyboard to another . 	keyboard	2
1549	has a 5 - 6 hour battery life . 	battery life	2
2086	my only issues are :  1 )  the screen / video resolution wo n't  increase to a higher resolution then 1024 x 60	screen / video resolution	1
2086	my only issues are :  1 )  the screen / video resolution wo n't  increase to a higher resolution then 1024 x 60	resolution	1
300	i run dreamweaver ,  final cut pro 7 ,  photoshop ,  safari ,  firefox ,  msn messenger and a few other applications constantly at the same time . 	applications	2
300	i run dreamweaver ,  final cut pro 7 ,  photoshop ,  safari ,  firefox ,  msn messenger and a few other applications constantly at the same time . 	dreamweaver	2
300	i run dreamweaver ,  final cut pro 7 ,  photoshop ,  safari ,  firefox ,  msn messenger and a few other applications constantly at the same time . 	final cut pro 7	2
300	i run dreamweaver ,  final cut pro 7 ,  photoshop ,  safari ,  firefox ,  msn messenger and a few other applications constantly at the same time . 	photoshop	2
300	i run dreamweaver ,  final cut pro 7 ,  photoshop ,  safari ,  firefox ,  msn messenger and a few other applications constantly at the same time . 	safari	2
300	i run dreamweaver ,  final cut pro 7 ,  photoshop ,  safari ,  firefox ,  msn messenger and a few other applications constantly at the same time . 	firefox	2
300	i run dreamweaver ,  final cut pro 7 ,  photoshop ,  safari ,  firefox ,  msn messenger and a few other applications constantly at the same time . 	msn messenger	2
851	i was told by many  that it was a great computer ,  but we got one of these ,  and it worked  great for one year ,  and as soon as the warrenty was up ,  then it got  really bad . 	warrenty	1
1008	ive had to call tech support many times . 	tech support	2
2261	the apple applications  ( ex . iphoto )  are fun ,  easy ,  and really cool to use  ( unlike the competition )  ! 	apple applications	0
2261	the apple applications  ( ex . iphoto )  are fun ,  easy ,  and really cool to use  ( unlike the competition )  ! 	iphoto	0
291	not to mention it has shit gigs . 	gigs	1
391	i paid for extra memory and the 17 - inch screen ,  as well as the top of the line dvd and cd burners . 	memory	2
391	i paid for extra memory and the 17 - inch screen ,  as well as the top of the line dvd and cd burners . 	17 - inch screen	2
391	i paid for extra memory and the 17 - inch screen ,  as well as the top of the line dvd and cd burners . 	dvd	0
391	i paid for extra memory and the 17 - inch screen ,  as well as the top of the line dvd and cd burners . 	cd burners	0
1595	its pretty fast and does not have hiccups while i am using it for web browsing ,  uploading photos ,  watching movies  ( 720p )  on occasion and creating presentations . 	web browsing	0
1595	its pretty fast and does not have hiccups while i am using it for web browsing ,  uploading photos ,  watching movies  ( 720p )  on occasion and creating presentations . 	uploading photos	0
1595	its pretty fast and does not have hiccups while i am using it for web browsing ,  uploading photos ,  watching movies  ( 720p )  on occasion and creating presentations . 	watching movies	0
1595	its pretty fast and does not have hiccups while i am using it for web browsing ,  uploading photos ,  watching movies  ( 720p )  on occasion and creating presentations . 	creating presentations	0
2362	quality display  i love hp ,  ,  it 's  the only computer / printer we will buy . 	quality display	0
116	despite the inconvenient weight ,  i opted for the 12 cell battery . 	12 cell battery	0
2647	the case is carved out of a single block of aluminum . 	case	2
980	first it burned or fused the power adapter plug . 	power adapter plug	1
668	the features are great ,  the only thing it needs is better speakers . 	features	0
668	the features are great ,  the only thing it needs is better speakers . 	speakers	1
1106	it was still working ,  but there was nothing on the screen . 	screen	1
140	i bought this laptop and found its tab is not functioning . 	tab	1
1418	toshiba is aware of the issue but unless the extended warrenty is bought toshiba will do nothing about it . 	extended warrenty	1
621	 - called headquarters again ,  they report that tft panel is broken ,  should be fixed by the end of the week  ( week 3 )  . 	tft panel	1
2360	navigation through the computer is far superior compared to windows operating systems ,  as well . 	navigation	0
2360	navigation through the computer is far superior compared to windows operating systems ,  as well . 	windows operating systems	1
1126	the screen is framed by half -  to a full - inch margin that is obviously unnecessary ,  reduces the screen size and increases the bulk . 	screen	1
1126	the screen is framed by half -  to a full - inch margin that is obviously unnecessary ,  reduces the screen size and increases the bulk . 	screen size	1
1126	the screen is framed by half -  to a full - inch margin that is obviously unnecessary ,  reduces the screen size and increases the bulk . 	bulk	1
1745	though the picture ,  video ,  and music software is nowhere close to professional grade software im used to  ( cs5 )  but does the job for beginner and even intermediate media designers . 	music software	1
1745	though the picture ,  video ,  and music software is nowhere close to professional grade software im used to  ( cs5 )  but does the job for beginner and even intermediate media designers . 	software	0
1745	though the picture ,  video ,  and music software is nowhere close to professional grade software im used to  ( cs5 )  but does the job for beginner and even intermediate media designers . 	picture	1
1745	though the picture ,  video ,  and music software is nowhere close to professional grade software im used to  ( cs5 )  but does the job for beginner and even intermediate media designers . 	video	1
39	the much lauded combined touch pad and clicker is a nightmare . 	combined touch pad and clicker	1
3019	the unibody construction is solid ,  sleek and beautiful . 	unibody construction	0
2469	this macbook is an outstanding product with great value . 	value	0
1986	i had to re - install windows within two weeks of the purchase and soon discovered cracks in the screen hinges . 	windows	1
1986	i had to re - install windows within two weeks of the purchase and soon discovered cracks in the screen hinges . 	screen hinges	1
1088	a second problem involves the battery which is advertised as having a storage life of 11 hours but when fully charged shows only 7 hours of service . 	battery	1
1088	a second problem involves the battery which is advertised as having a storage life of 11 hours but when fully charged shows only 7 hours of service . 	service	1
678	and plenty of storage with 250 gb ( though i will upgrade this and the ram .  .  ) 	storage	0
678	and plenty of storage with 250 gb ( though i will upgrade this and the ram .  .  ) 	ram	2
625	no temporary replacement ,  they are out of replacements because  " many computers had problems with the nvidia chipset "  - inquired status of repair . 	nvidia chipset	1
2035	i took it to friend who temporarily fixed it and i finally paid about 1500 for the extended warranty . 	extended warranty	2
1921	programs would crash all the time ,  and it turned out to be a very unstable ,  unreliable laptop for me . 	programs	1
1872	i bought this lap top and the charge time dose n't  last as long as they say it will more like 2 hours	charge time	1
1413	also ,  because of the size and consistancy of the laptop computer ,  some websites would n't  even attempt to work on the computer because of browser problems . 	size	1
1413	also ,  because of the size and consistancy of the laptop computer ,  some websites would n't  even attempt to work on the computer because of browser problems . 	consistancy	1
2636	the key bindings take a little getting used to ,  but have loved the macbook pro . 	key bindings	1
357	keyboard is reasonable size . 	keyboard	0
357	keyboard is reasonable size . 	size	0
3075	i find myself using the 10 - key more than i thought i would . 	10 - key	0
3045	fan noise :  the fan made a constant hissing noise in the background . 	fan	1
3045	fan noise :  the fan made a constant hissing noise in the background . 	fan	1
235	the screen is bright and clear ,  the operating system is solid and friendly to a novice . 	screen	0
235	the screen is bright and clear ,  the operating system is solid and friendly to a novice . 	operating system	0
3055	it has a  . 1 ghz faster processor and a stock 500gb hard drive . 	processor	0
3055	it has a  . 1 ghz faster processor and a stock 500gb hard drive . 	500gb hard drive	0
2865	the feature are good enough for what i need . 	feature	0
1197	finally ,  the biggest problem has been tech support . 	tech support	1
2676	 "  this is n't  a big deal ,  i have n't  noticed the issue with dvds or other media ,  only through usb output . 	usb output	1
2319	with windows laptops a wireless mouse is an absolute must . 	wireless mouse	2
452	 ( i had been a windows / linux user before this )  i love the size because the screen is big enough for what i use it for  ( internet ,  artwork )  ,  and yet it is small enough to be reasonably portable . 	size	0
452	 ( i had been a windows / linux user before this )  i love the size because the screen is big enough for what i use it for  ( internet ,  artwork )  ,  and yet it is small enough to be reasonably portable . 	screen	0
452	 ( i had been a windows / linux user before this )  i love the size because the screen is big enough for what i use it for  ( internet ,  artwork )  ,  and yet it is small enough to be reasonably portable . 	windows	2
452	 ( i had been a windows / linux user before this )  i love the size because the screen is big enough for what i use it for  ( internet ,  artwork )  ,  and yet it is small enough to be reasonably portable . 	linux	2
2498	but if you 're  willing to pay another 200 dollar for a windows disc . 	windows disc	2
2515	very good quality and well made . 	quality	0
2320	i bought a logitech desktop set in anticipation for using with the mbp ,  but i use the touchpad 90% of the time . 	touchpad	0
