review_id	review_text	aspect_term	polarity
1591	strong performance in this device makes use of fun and a strong sense of the era of speed this device serves all modern requirements is a very strong game and is very useful for designers . 	speed	0
1591	strong performance in this device makes use of fun and a strong sense of the era of speed this device serves all modern requirements is a very strong game and is very useful for designers . 	use	0
1067	unless you need the bluetooth 3 . 	bluetooth 3	2
536	i was sorly disapointed to discover that hp  ( what i thought was a reputable company )  would n't  honor the warrenty when the fan blade fell apart . 	warrenty	1
536	i was sorly disapointed to discover that hp  ( what i thought was a reputable company )  would n't  honor the warrenty when the fan blade fell apart . 	fan blade	1
1434	more times that not the screen pops up saying i have a bad internet connection ,  or the page ca n't  be displayed . 	internet connection	1
293	do yourself a favor and invest in a few external harddrives if you are planning on purchasing this laptop . 	external harddrives	1
2386	i do n't  understand why only windows 7 starter is included . 	windows 7 starter	1
18	while most people say that pcs hold functionality and value and macs are just pretty to look at ,  i think there 's  something to be said about the simplicity of macs . 	functionality	0
18	while most people say that pcs hold functionality and value and macs are just pretty to look at ,  i think there 's  something to be said about the simplicity of macs . 	value	0
18	while most people say that pcs hold functionality and value and macs are just pretty to look at ,  i think there 's  something to be said about the simplicity of macs . 	simplicity	0
18	while most people say that pcs hold functionality and value and macs are just pretty to look at ,  i think there 's  something to be said about the simplicity of macs . 	look	0
1610	my macbook is so much better looking and so thin ! 	looking	0
2292	the ease of use is wonderful . 	use	0
2596	this system came loaded with windows 7 starter . 	windows 7 starter	2
614	 - when battery life went to 4 hours or less ,  took it to the machouse amsterdam for repair  ( 26th of august )  . 	battery life	1
171	the battery gets so hot it is scary . 	battery	1
2753	best thing is i can use existing 32 bit old programs . 	programs	0
3	it 's  so nice to look at and the keys are easy to type with . 	keys	0
3	it 's  so nice to look at and the keys are easy to type with . 	look	0
1641	i am forever changed and will no longer buy a windows based machine for personal use . 	windows	1
2814	the only thing i would change about it is the mouse keys . 	mouse keys	1
43	it is absolutely horrible to use ,  despite all its so called advanced features . 	features	1
43	it is absolutely horrible to use ,  despite all its so called advanced features . 	use	1
1056	before ,  i reloaded with windows 7 ultimate and used only the downloaded drivers from acer 's  site . 	drivers	2
1056	before ,  i reloaded with windows 7 ultimate and used only the downloaded drivers from acer 's  site . 	windows 7 ultimate	2
2996	i have to keep turning it until it decides to lower and there is no mute . 	mute	1
3022	it 's  still beautiful and has better color reproduction than i could ever expect from a notebook . 	color reproduction	0
1850	after that i turned to email in my next vain help to get them to acknowledge that the warranty was still valid . 	warranty	2
2368	he loves it and it is easy to use and well the schools start teaching the kids early about computers so it was easy for him to get started . 	use	0
2233	u can do what u want in just few seconds ,  even to start up your computer takes few seconds . 	start up	0
1613	also ,  macbooks come with much more features which are so cool ! 	features	0
510	they sent out a sony 'certified' technician . 	sony 'certified' technician	2
2353	they have developed excellent proprietary software for editing video and pictures and i 'm  looking forward to utilizing these tools on the regular . 	proprietary software	0
2563	getting the apple care plan is a must . 	apple care plan	0
2306	overall i would recomend this to anybody and tell them that if they want to burn their music or play there video games to buy the cd drive . 	cd drive	2
2306	overall i would recomend this to anybody and tell them that if they want to burn their music or play there video games to buy the cd drive . 	video games	2
1432	i am constantly trying to uninstall programs ,  clean cookies ,  and delete unused files . 	programs	2
102	the dv4 boasted a faster processor ,  more memory ,  and a bigger hard drive than my old computer ,  plus a better quality web cam ,  nicer screen ,  and many other features . 	processor	0
102	the dv4 boasted a faster processor ,  more memory ,  and a bigger hard drive than my old computer ,  plus a better quality web cam ,  nicer screen ,  and many other features . 	memory	0
102	the dv4 boasted a faster processor ,  more memory ,  and a bigger hard drive than my old computer ,  plus a better quality web cam ,  nicer screen ,  and many other features . 	hard drive	0
102	the dv4 boasted a faster processor ,  more memory ,  and a bigger hard drive than my old computer ,  plus a better quality web cam ,  nicer screen ,  and many other features . 	web cam	0
102	the dv4 boasted a faster processor ,  more memory ,  and a bigger hard drive than my old computer ,  plus a better quality web cam ,  nicer screen ,  and many other features . 	screen	0
102	the dv4 boasted a faster processor ,  more memory ,  and a bigger hard drive than my old computer ,  plus a better quality web cam ,  nicer screen ,  and many other features . 	features	0
2966	the only downfall is the battery only last 1 . 5 - 2 . 0 hrs when not plugged in . 	battery	1
2211	the graphics on this computer are also stellar  -  very clear and vivid . 	graphics	0
2819	aside from the trial software and the short battery life ,  lack of a webcam ,  its great . 	trial software	1
2819	aside from the trial software and the short battery life ,  lack of a webcam ,  its great . 	battery life	1
2819	aside from the trial software and the short battery life ,  lack of a webcam ,  its great . 	webcam	1
1633	as a die - hard windows enthusiast ,  i shunned the idea of a mac until this point . 	windows	0
1351	i think that if it is the motherboard again so soon that they should replace it . 	motherboard	1
2220	the computer loads in about a 1 / 10th of the time that my pc did ,  and i have all of the programs that were on my pc . 	programs	0
2220	the computer loads in about a 1 / 10th of the time that my pc did ,  and i have all of the programs that were on my pc . 	loads	0
2723	graphics are clean and sharp ,  internet interfaces are seamless . 	graphics	0
2723	graphics are clean and sharp ,  internet interfaces are seamless . 	internet interfaces	0
73	the newer black keyboard took a little bit away from the previous gray one which looked really slick ,  but it is still a great notebook ! 	black keyboard	1
1082	sony parts reliability and quality of service is recenlty the worst . 	service	1
2677	as with any laptop not purchased with software options ,  it comes with a lot of what i consider useless applications . 	software options	1
2677	as with any laptop not purchased with software options ,  it comes with a lot of what i consider useless applications . 	applications	1
2588	its office compatible ,  but the features and its functioning is all new again so you might as well save the money and just learn the pre installed mac programs . 	features	2
2588	its office compatible ,  but the features and its functioning is all new again so you might as well save the money and just learn the pre installed mac programs . 	functioning	2
2588	its office compatible ,  but the features and its functioning is all new again so you might as well save the money and just learn the pre installed mac programs . 	programs	2
2588	its office compatible ,  but the features and its functioning is all new again so you might as well save the money and just learn the pre installed mac programs . 	office	0
223	it just works flawlessly ! 	works	0
1332	do you think i purposely  " destroy "  my netbook ,  so that i can demand a new set ?  do you think it 's  fun to take public transport all the way to the service center and get a non - satisfactory solution ?  or rather no solution . 	service center	1
846	i 'm  having the laptop returned unrepaired since paying $176 every 3  months just is n't  worth it  ( that 's  about how long the port seems to  last )  . 	port	1
1455	also the battery is completely shot . 	battery	1
162	 /  awesome cooling system /  much better grafics card  ( ati 5870 )   /  8gb ram /  led backlit screen .  .  . 	cooling system	0
162	 /  awesome cooling system /  much better grafics card  ( ati 5870 )   /  8gb ram /  led backlit screen .  .  . 	grafics card	0
162	 /  awesome cooling system /  much better grafics card  ( ati 5870 )   /  8gb ram /  led backlit screen .  .  . 	led backlit screen . 	0
162	 /  awesome cooling system /  much better grafics card  ( ati 5870 )   /  8gb ram /  led backlit screen .  .  . 	8gb ram	0
969	the biggest problem is that the box had no instructions in it . 	instructions	1
145	but after using it a couple of weeks ,  the overall operation is poor . 	operation	1
2187	compared to similarly spec 'd  pcs ,  this machine is good value ,  well built and works easily right out of the box . 	value	0
2187	compared to similarly spec 'd  pcs ,  this machine is good value ,  well built and works easily right out of the box . 	built	0
2187	compared to similarly spec 'd  pcs ,  this machine is good value ,  well built and works easily right out of the box . 	works	0
2812	screen is crystal clear and the system is very responsive . 	screen	0
2812	screen is crystal clear and the system is very responsive . 	system	0
1028	or the cursor would show up some place else . 	cursor	1
87	it is easy to operate and i have already ordered more software and gadgets for my new rolls royce of laptops . 	software	2
87	it is easy to operate and i have already ordered more software and gadgets for my new rolls royce of laptops . 	operate	0
87	it is easy to operate and i have already ordered more software and gadgets for my new rolls royce of laptops . 	gadgets	2
1997	it might be something deep within windows ,  for i was unable to create a disk image on my hard drive . 	windows	1
1997	it might be something deep within windows ,  for i was unable to create a disk image on my hard drive . 	hard drive	1
1997	it might be something deep within windows ,  for i was unable to create a disk image on my hard drive . 	disk image	1
2548	the track pad to me is what really stands out though ,  you can do several different things with it just depending on how many fingers you use on the track pad ,  awesome thinking apple ! 	track pad	0
2548	the track pad to me is what really stands out though ,  you can do several different things with it just depending on how many fingers you use on the track pad ,  awesome thinking apple ! 	track pad	0
953	now i had not tried to use this since the disc drive had been replaced and after taking it back to the geek squad i found out they had accidently not used the right drive when they replaced the first one ,  so back it went to get the correct drive . 	disc drive	1
953	now i had not tried to use this since the disc drive had been replaced and after taking it back to the geek squad i found out they had accidently not used the right drive when they replaced the first one ,  so back it went to get the correct drive . 	drive	1
953	now i had not tried to use this since the disc drive had been replaced and after taking it back to the geek squad i found out they had accidently not used the right drive when they replaced the first one ,  so back it went to get the correct drive . 	drive	2
1179	first ,  you ll discover that the word processing program known as  appleworks  rarely translates perfectly on anyone else s computer ,  if it translates at all . 	appleworks	1
1179	first ,  you ll discover that the word processing program known as  appleworks  rarely translates perfectly on anyone else s computer ,  if it translates at all . 	word processing program	1
1876	i already have a hp laptop i bought last year that 's  standard size . 	size	2
2992	battery is not upgradable to a longer life battery . 	battery	1
2992	battery is not upgradable to a longer life battery . 	battery	1
559	apple has a reputation and is well known for its easy usage . 	usage	0
1888	returned laptop for a 3rd repair and it came back with previous problems fixed  ( except for speaker grill )  but the unit started locking up during use and eventually would not operate at all . 	speaker grill	1
1738	i just plug this into my 22 "  monitor and the speedy macosx performs just as well on this dual - core that my dell did with windows 7 with a quad - core . 	macosx	0
1738	i just plug this into my 22 "  monitor and the speedy macosx performs just as well on this dual - core that my dell did with windows 7 with a quad - core . 	windows 7	0
1738	i just plug this into my 22 "  monitor and the speedy macosx performs just as well on this dual - core that my dell did with windows 7 with a quad - core . 	dual - core	2
1738	i just plug this into my 22 "  monitor and the speedy macosx performs just as well on this dual - core that my dell did with windows 7 with a quad - core . 	quad - core	2
1738	i just plug this into my 22 "  monitor and the speedy macosx performs just as well on this dual - core that my dell did with windows 7 with a quad - core . 	22 " monitor	2
374	love the graphics ,  awesome programs  ( including garageband )  ,  and really cool default background . 	graphics	0
374	love the graphics ,  awesome programs  ( including garageband )  ,  and really cool default background . 	programs	0
374	love the graphics ,  awesome programs  ( including garageband )  ,  and really cool default background . 	garageband	0
374	love the graphics ,  awesome programs  ( including garageband )  ,  and really cool default background . 	default background	0
1746	screen ,  keyboard ,  and mouse :  if you cant see yourself spending the extra money to jump up to a mac the beautiful screen ,  responsive island backlit keyboard ,  and fun multi - touch mouse is worth the extra money to me alone . 	screen	2
1746	screen ,  keyboard ,  and mouse :  if you cant see yourself spending the extra money to jump up to a mac the beautiful screen ,  responsive island backlit keyboard ,  and fun multi - touch mouse is worth the extra money to me alone . 	keyboard	2
1746	screen ,  keyboard ,  and mouse :  if you cant see yourself spending the extra money to jump up to a mac the beautiful screen ,  responsive island backlit keyboard ,  and fun multi - touch mouse is worth the extra money to me alone . 	screen	0
1746	screen ,  keyboard ,  and mouse :  if you cant see yourself spending the extra money to jump up to a mac the beautiful screen ,  responsive island backlit keyboard ,  and fun multi - touch mouse is worth the extra money to me alone . 	island backlit keyboard	0
1746	screen ,  keyboard ,  and mouse :  if you cant see yourself spending the extra money to jump up to a mac the beautiful screen ,  responsive island backlit keyboard ,  and fun multi - touch mouse is worth the extra money to me alone . 	multi - touch mouse	0
1746	screen ,  keyboard ,  and mouse :  if you cant see yourself spending the extra money to jump up to a mac the beautiful screen ,  responsive island backlit keyboard ,  and fun multi - touch mouse is worth the extra money to me alone . 	mouse	2
279	the macbook is way too overpriced for something so simple and chaotic . 	overpriced	1
79	the os takes some getting used to especially after being a windows user for so long but the learning curve is so worth it ! 	windows	2
313	i also purchased iwork to go with it which has programs for word processing ,  spreadsheets ,  and presentations  ( similar to microsoft office )  . 	iwork	2
313	i also purchased iwork to go with it which has programs for word processing ,  spreadsheets ,  and presentations  ( similar to microsoft office )  . 	programs	2
313	i also purchased iwork to go with it which has programs for word processing ,  spreadsheets ,  and presentations  ( similar to microsoft office )  . 	microsoft office	2
313	i also purchased iwork to go with it which has programs for word processing ,  spreadsheets ,  and presentations  ( similar to microsoft office )  . 	word processing	2
313	i also purchased iwork to go with it which has programs for word processing ,  spreadsheets ,  and presentations  ( similar to microsoft office )  . 	spreadsheets	2
313	i also purchased iwork to go with it which has programs for word processing ,  spreadsheets ,  and presentations  ( similar to microsoft office )  . 	presentations	2
1694	overall ,  i experienced a huge change in that my mac runs pretty fast compared to my old pc . 	runs	0
174	when i got the computer back and realizwed it still was not correct hp told me it was out of warranty and now it was my problem . 	warranty	2
2452	it also came with a built it web cam which is great because i can see an communicate with my family members back home . 	built it web cam	0
2751	good monitor and performed well . 	monitor	0
2751	good monitor and performed well . 	performed	0
2524	it was secure and easy to navigate . 	navigate	0
1598	i was a little weary at purchasing another 13 "  macbook almost 2 years later but t looks like the newer macbooks have gotten its current line of graphics cards in order this time around . 	graphics cards	0
267	the machine has a bluray player the book has no mention of it or how to connect it to your hdtv . 	bluray player	2
267	the machine has a bluray player the book has no mention of it or how to connect it to your hdtv . 	book	1
2182	they are by far the easiest systems to actually learn about computers with . 	systems	0
561	this apple navigates you thru the unexplored world of the internet . 	internet	2
154	the video card is great for media ,  and above average for gaming ,  but not a gamers first choice . 	gaming	0
154	the video card is great for media ,  and above average for gaming ,  but not a gamers first choice . 	media	0
100	i had of course bought a 3 year warranty ,  so i sent it in to be replaced and  ( almost 2 months later )  the dv4 is what the sent me as a replacement . 	3 year warranty , 	2
1444	apparently there is a manufacturing defect ,  something with the amount of thermal paste . 	thermal paste	1
1796	despite the claims of the apple apologists  ( a vice of which i am recently myself reformed )  the internals of mac laptops are no different from pcs' at this point . 	internals	1
753	took several hours with customer support before i could even start the pc out of the box . 	customer support	1
411	asus facial recognition does n't  work and windows logon is n't  either . 	facial recognition	1
411	asus facial recognition does n't  work and windows logon is n't  either . 	windows logon	1
988	windows vista makes this computer almost unusable for online service . 	windows vista	1
988	windows vista makes this computer almost unusable for online service . 	online service	1
1071	i contacted acer and they are giving me free recovery dvds ,  so do n't  go and pay for them ,  just ask for them and they should give them to you . 	recovery dvds	0
2830	now when i order i did not go full scale for the webcam or full keyboard i wanted something for basics of being easy to carry when i use crutchs or wheelchair and with a backpack laptop bag . 	webcam	2
2830	now when i order i did not go full scale for the webcam or full keyboard i wanted something for basics of being easy to carry when i use crutchs or wheelchair and with a backpack laptop bag . 	keyboard	2
2830	now when i order i did not go full scale for the webcam or full keyboard i wanted something for basics of being easy to carry when i use crutchs or wheelchair and with a backpack laptop bag . 	carry	0
2701	can listen to my music and watch my videos with ease and with a great display . 	display	0
2968	otherwise ,  all other features are a 1	features	2
1723	the performance is awesome . 	performance	0
286	the display is beyond horrible . 	display	1
1411	there is hardly any memory on the computer 's  hard drive . 	memory	1
1411	there is hardly any memory on the computer 's  hard drive . 	hard drive	1
1956	actually ,  i had noticed the one on the sales floor also did n't  have sound ! 	sound	1
1469	next ,  most acer laptop fans are on the bottom which is right on your laptop . 	fans	2
2833	the laptop preformed pretty well . 	preformed	0
298	i got my macbook pro because i wanted to do all the stuff i need to do without worrying about the system quitting on me or freezing for a few minutes . 	system	2
1447	i loved the netbook  ( minus the fact that it was windows os )  until this started happening . 	windows os	1
1810	the minute you fire it up it 's  all good ,  very easy user interface . 	user interface	0
1419	i actually contact toshiba before i started having problem and was given run around after i supplied serial number in order to delay me sending in laptop until after warrenty expired . 	warrenty	1
1660	theres also idvd ,  a program dedicated to putting all your favorite media together -  photos ,  recordings ,  video projects into one program so that you can create the perfect memoir for your parents ,  family ,  siblings ,  and any other person important in your life that there may be . 	idvd	0
1660	theres also idvd ,  a program dedicated to putting all your favorite media together -  photos ,  recordings ,  video projects into one program so that you can create the perfect memoir for your parents ,  family ,  siblings ,  and any other person important in your life that there may be . 	program	0
1660	theres also idvd ,  a program dedicated to putting all your favorite media together -  photos ,  recordings ,  video projects into one program so that you can create the perfect memoir for your parents ,  family ,  siblings ,  and any other person important in your life that there may be . 	program	0
459	after replacing the hard drive the battery stopped working   ( 3 months of use )  which was frustrating . 	hard drive	2
459	after replacing the hard drive the battery stopped working   ( 3 months of use )  which was frustrating . 	battery	1
2884	i love the easy to see screen ,  and it works well for work ,  persoal or just play . 	screen	0
2884	i love the easy to see screen ,  and it works well for work ,  persoal or just play . 	works	0
2082	if what you need is a machine to do some surfing ,  email checking ,  word processing ,  and watching a movie or two ,  this is the machine you want . 	word processing	2
2082	if what you need is a machine to do some surfing ,  email checking ,  word processing ,  and watching a movie or two ,  this is the machine you want . 	surfing	2
1391	the mouse pad and buttons are the worst i 've  ever seen . 	mouse pad	1
1391	the mouse pad and buttons are the worst i 've  ever seen . 	buttons	1
2257	awesome graphics ! 	graphics	0
2617	it really is perfect for work and play . 	play	0
2617	it really is perfect for work and play . 	work	0
2653	the pro is a great product ,  i wish that the 13 inch models came with the intel i processors and had a more comfortable edge  ( the edges hurt my wrists )  . 	intel i processors	1
2653	the pro is a great product ,  i wish that the 13 inch models came with the intel i processors and had a more comfortable edge  ( the edges hurt my wrists )  . 	edge	1
2653	the pro is a great product ,  i wish that the 13 inch models came with the intel i processors and had a more comfortable edge  ( the edges hurt my wrists )  . 	edges	1
2674	one drawback i noticed was sound quality via usb . 	sound quality via usb	1
519	the battery life sucked the juice from my laptop and when the extended life battery went out we were sol there to ,  so much for that warranty covering all the products we purchased . 	battery life	1
519	the battery life sucked the juice from my laptop and when the extended life battery went out we were sol there to ,  so much for that warranty covering all the products we purchased . 	warranty	1
1534	i have had another mac ,  but it got slow due to an older operating system . 	operating system	1
105	that 's  very possible ,  but since they do n't  make windows xp drivers for the sound card in this machine ,  i was stuck until windows 7 came out . 	windows xp drivers	1
105	that 's  very possible ,  but since they do n't  make windows xp drivers for the sound card in this machine ,  i was stuck until windows 7 came out . 	sound card	1
105	that 's  very possible ,  but since they do n't  make windows xp drivers for the sound card in this machine ,  i was stuck until windows 7 came out . 	windows 7	0
3065	i'ts nice to have the higher - end laptops ,  but this fits my budget and the features i need . 	features	0
3065	i'ts nice to have the higher - end laptops ,  but this fits my budget and the features i need . 	budget	0
2057	was disappointed to find out that the model had been discontinued ,  apparently because of known motherboard problems . 	motherboard	1
2073	also the speakers are not very loud ,  but it is a netbook . 	speakers	1
2890	love this laptop wonderful price for what you get ! 	price	0
508	just a black screen ! 	screen	1
2352	a key contributor that led me to mac is the art aspect . 	art aspect	0
1923	eventually my battery would n't  charge ,  so unless i had it plugged in it would n't  even power on . 	battery	1
2631	purchased for development purposes ,  but it has turned into my everyday laptop as well for surfing ,  e - mail ,  etc . 	surfing	0
