review_id	review_text	aspect_term	polarity
2339	i charge it at night and skip taking the cord with me because of the good battery life . 	cord	2
2339	i charge it at night and skip taking the cord with me because of the good battery life . 	battery life	0
1316	the tech guy then said the service center does not do 1 - to - 1 exchange and i have to direct my concern to the  " sales "  team ,  which is the retail shop which i bought my netbook from . 	service center	1
1316	the tech guy then said the service center does not do 1 - to - 1 exchange and i have to direct my concern to the  " sales "  team ,  which is the retail shop which i bought my netbook from . 	 " sales " team	1
1316	the tech guy then said the service center does not do 1 - to - 1 exchange and i have to direct my concern to the  " sales "  team ,  which is the retail shop which i bought my netbook from . 	tech guy	2
2005	it is of high quality ,  has a killer gui ,  is extremely stable ,  is highly expandable ,  is bundled with lots of very good applications ,  is easy to use ,  and is absolutely gorgeous . 	quality	0
2005	it is of high quality ,  has a killer gui ,  is extremely stable ,  is highly expandable ,  is bundled with lots of very good applications ,  is easy to use ,  and is absolutely gorgeous . 	gui	0
2005	it is of high quality ,  has a killer gui ,  is extremely stable ,  is highly expandable ,  is bundled with lots of very good applications ,  is easy to use ,  and is absolutely gorgeous . 	applications	0
2005	it is of high quality ,  has a killer gui ,  is extremely stable ,  is highly expandable ,  is bundled with lots of very good applications ,  is easy to use ,  and is absolutely gorgeous . 	use	0
2789	easy to start up and does not overheat as much as other laptops . 	start up	0
76	i even got my teenage son one ,  because of the features that it offers ,  like ,  ichat ,  photobooth ,  garage band and more ! 	features	0
76	i even got my teenage son one ,  because of the features that it offers ,  like ,  ichat ,  photobooth ,  garage band and more ! 	ichat	0
76	i even got my teenage son one ,  because of the features that it offers ,  like ,  ichat ,  photobooth ,  garage band and more ! 	photobooth	0
76	i even got my teenage son one ,  because of the features that it offers ,  like ,  ichat ,  photobooth ,  garage band and more ! 	garage band	0
80	great laptop that offers many great features ! 	features	0
917	one night i turned the freaking thing off after using it ,  the next day i turn it on ,  no gui ,  screen all dark ,  power light steady ,  hard drive light steady and not flashing as it usually does . 	gui	1
917	one night i turned the freaking thing off after using it ,  the next day i turn it on ,  no gui ,  screen all dark ,  power light steady ,  hard drive light steady and not flashing as it usually does . 	screen	1
917	one night i turned the freaking thing off after using it ,  the next day i turn it on ,  no gui ,  screen all dark ,  power light steady ,  hard drive light steady and not flashing as it usually does . 	power light	2
917	one night i turned the freaking thing off after using it ,  the next day i turn it on ,  no gui ,  screen all dark ,  power light steady ,  hard drive light steady and not flashing as it usually does . 	hard drive ligh	1
338	my only disappointment with the 13 "  model is that they 're  the only ones in the macbook pro line up without an i5 or i7 processor and dual graphics cards ,  however the trade - off is that you achieve a longer battery life  ( of about 2 more hours )  . 	processor	1
338	my only disappointment with the 13 "  model is that they 're  the only ones in the macbook pro line up without an i5 or i7 processor and dual graphics cards ,  however the trade - off is that you achieve a longer battery life  ( of about 2 more hours )  . 	graphics cards	1
338	my only disappointment with the 13 "  model is that they 're  the only ones in the macbook pro line up without an i5 or i7 processor and dual graphics cards ,  however the trade - off is that you achieve a longer battery life  ( of about 2 more hours )  . 	battery life	0
1630	i took it back for an asus and same thing -  blue screen which required me to remove the battery to reset . 	battery	2
38	in the shop ,  these macbooks are encased in a soft rubber enclosure  -  so you will never know about the razor edge until you buy it ,  get it home ,  break the seal and use it  ( very clever con )  . 	rubber enclosure	0
38	in the shop ,  these macbooks are encased in a soft rubber enclosure  -  so you will never know about the razor edge until you buy it ,  get it home ,  break the seal and use it  ( very clever con )  . 	edge	1
337	however ,  the multi - touch gestures and large tracking area make having an external mouse unnecessary  ( unless you 're  gaming )  . 	multi - touch gestures	0
337	however ,  the multi - touch gestures and large tracking area make having an external mouse unnecessary  ( unless you 're  gaming )  . 	tracking area	0
337	however ,  the multi - touch gestures and large tracking area make having an external mouse unnecessary  ( unless you 're  gaming )  . 	external mouse	2
337	however ,  the multi - touch gestures and large tracking area make having an external mouse unnecessary  ( unless you 're  gaming )  . 	gaming	2
2568	i love the way the entire suite of software works together . 	suite of software	0
295	the speed is incredible and i am more than satisfied . 	speed	0
2759	this laptop meets every expectation and windows 7 is great ! 	windows 7	0
2980	i can barely use any usb devices because they will not stay connected properly . 	usb devices	1
743	when i finally had everything running with all my software installed i plugged in my droid to recharge and the system crashed . 	software	2
743	when i finally had everything running with all my software installed i plugged in my droid to recharge and the system crashed . 	system	1
2587	one suggestion i do have ,  is to not bother getting microsoft office for the mac expecting it will work just like you knew it to on a pc . 	microsoft office for the mac	1
2202	pairing it with an iphone is a pure pleasure  -  talk about painless syncing  -  used to take me forever  -  now it 's  a snap . 	syncing	0
2227	i also got the added bonus of a 30 "  hd monitor ,  which really helps to extend my screen and keep my eyes fresh ! 	30 " hd monitor	0
2227	i also got the added bonus of a 30 "  hd monitor ,  which really helps to extend my screen and keep my eyes fresh ! 	screen	2
92	the machine is slow to boot up and occasionally crashes completely . 	boot up	1
1204	after paying several hundred dollars for this service ,  it is frustrating that you cannot get help after hours . 	service	1
1574	i love the operating system and the preloaded software . 	operating system	0
1574	i love the operating system and the preloaded software . 	preloaded software	0
3073	the best thing about this laptop is the price along with some of the newer features . 	price	0
3073	the best thing about this laptop is the price along with some of the newer features . 	features	0
1254	after numerous attempts of trying  ( including setting the clock in bios setup directly )  ,  i gave up ( i am a techie )  . 	clock in bios setup	1
810	you will not be able to talk to an american warranty service is out of country . 	warranty service	1
130	but now i have realized its a problem with this brand . 	brand	1
839	i sent it back to toshiba twice they covered it under the  warranty . 	warranty	0
696	i was looking for a mac which is portable and has all the features that i was looking for . 	features	0
1030	also kinda loud when the fan was running . 	fan	1
1425	in desparation ,  i called their customer service number and was told that my warranty had expired  ( 2 days old )  and that the priviledge of talking to a technician would cost me  (  " have your credit card ready "  )  . 	customer service number	2
1425	in desparation ,  i called their customer service number and was told that my warranty had expired  ( 2 days old )  and that the priviledge of talking to a technician would cost me  (  " have your credit card ready "  )  . 	warranty	1
1425	in desparation ,  i called their customer service number and was told that my warranty had expired  ( 2 days old )  and that the priviledge of talking to a technician would cost me  (  " have your credit card ready "  )  . 	talking to a technician	1
661	there also seemed to be a problem with the hard disc as certain times windows loads but claims to not be able to find any drivers or files . 	hard disc	1
661	there also seemed to be a problem with the hard disc as certain times windows loads but claims to not be able to find any drivers or files . 	windows	1
661	there also seemed to be a problem with the hard disc as certain times windows loads but claims to not be able to find any drivers or files . 	drivers	2
997	drivers updated ok but the bios update froze the system up and the computer shut down . 	drivers	0
997	drivers updated ok but the bios update froze the system up and the computer shut down . 	bios update	1
997	drivers updated ok but the bios update froze the system up and the computer shut down . 	system	1
463	spent 2 hours on phone with hp technical support . 	hp technical support	2
1193	speaking of the browser ,  it too has problems . 	browser	1
147	the keyboard is too slick . 	keyboard	1
1433	nightly my computer defrags itself and runs a virus scan . 	virus scan	2
1669	it 's  like 9 punds ,  but if you can look past it ,  it 's  great ! 	9 punds	1
2462	it 's  just as fast with one program open as it is with sixteen open . 	program	2
2719	still under warrenty so called toshiba ,  no help at all . 	warrenty	1
1224	i was happy with my purchase of a toshiba satellite l305d - s5934 laptop until it came time to have it repaired under the toshiba warranty . 	toshiba warranty	1
2492	amazing quality ! 	quality	0
1541	the fact that you can spend over $100 on just a webcam underscores the value of this machine . 	webcam	2
1541	the fact that you can spend over $100 on just a webcam underscores the value of this machine . 	value	0
3060	i mainly use it for email ,  internet ,  and managing personal files  ( pics ,  vids ,  etc .  )  . 	internet	2
3060	i mainly use it for email ,  internet ,  and managing personal files  ( pics ,  vids ,  etc .  )  . 	managing personal files	2
915	a month or so ago ,  the freaking motherboard just died . 	motherboard	1
2050	the system it comes with does not work properly ,  so when trying to fix the problems with it it started not working at all . 	system	1
460	then after 4 or so months the charger stopped working so i was forced to go out and buy new hardware just to keep this computer running . 	charger	1
460	then after 4 or so months the charger stopped working so i was forced to go out and buy new hardware just to keep this computer running . 	hardware	1
1524	if a website ever freezes  ( which is rare )  ,  its really easy to force quit . 	force quit	0
803	it rarely works and when it does it 's  incredibly slow . 	works	1
2225	i also enjoy the fact that my macbook pro laptop allows me to run windows 7 on it by using the vmware program . 	windows 7	0
2225	i also enjoy the fact that my macbook pro laptop allows me to run windows 7 on it by using the vmware program . 	vmware program	2
2644	it 's  so much easier to navigate through the operating system ,  to find files ,  and it runs a lot faster ! 	operating system	0
2644	it 's  so much easier to navigate through the operating system ,  to find files ,  and it runs a lot faster ! 	runs	0
2644	it 's  so much easier to navigate through the operating system ,  to find files ,  and it runs a lot faster ! 	navigate	0
2644	it 's  so much easier to navigate through the operating system ,  to find files ,  and it runs a lot faster ! 	find files	0
1365	purchased a toshiba lap top it worked good until just after the warrenty went out . 	warrenty	1
2033	i wanted to purchase the extended warranty and they refused ,  because they knew it was trouble . 	extended warranty	2
2271	we upgraded the memory to four gigabytes in order to take advantage of the performace increase in speed . 	memory	2
2271	we upgraded the memory to four gigabytes in order to take advantage of the performace increase in speed . 	speed	0
2271	we upgraded the memory to four gigabytes in order to take advantage of the performace increase in speed . 	performace	0
103	the reality was ,  it heated up very quickly ,  and took way too long to do simple things ,  like opening my documents folder . 	opening my documents folder	1
1149	i had always used pcs and been constantly frustrated by the crashing and the poorly designed operating systems that were never very intuitive . 	operating systems	1
900	then ,  within 5 months ,  the charger crapped out on me . 	charger	1
1649	and if you have a iphone or ipod touch you can connect and download songs to it at high speed . 	speed	0
446	i love the glass touchpad . 	glass touchpad	0
1912	i continued to take the computer in again and they replaced the hard drive and mother board yet again . 	hard drive	1
1912	i continued to take the computer in again and they replaced the hard drive and mother board yet again . 	mother board	1
2752	i am using the external speaker -  sound is good . 	external speaker	0
2752	i am using the external speaker -  sound is good . 	sound	0
2381	still testing the battery life as i thought it would be better ,  but am very happy with the upgrade . 	battery life	1
404	then hp sends it back to me with the hardware screwed up ,  not able to connect . 	hardware	1
407	oh yeah ,  do n't  forget the expensive shipping to and from hp . 	shipping	1
1731	everything is so easy to use ,  mac software is just so much simpler than microsoft software . 	mac software	0
1731	everything is so easy to use ,  mac software is just so much simpler than microsoft software . 	microsoft software	1
1731	everything is so easy to use ,  mac software is just so much simpler than microsoft software . 	use	0
1186	and if you do a lot of writing ,  editing is a problem since there is no  forward delete  key . 	delete key	1
1186	and if you do a lot of writing ,  editing is a problem since there is no  forward delete  key . 	editing	1
2470	its ease of use and the top service from apple -  be it their phone assistance or bellying up to the genius bar -  cannot be beat . 	use	0
2470	its ease of use and the top service from apple -  be it their phone assistance or bellying up to the genius bar -  cannot be beat . 	service	0
2470	its ease of use and the top service from apple -  be it their phone assistance or bellying up to the genius bar -  cannot be beat . 	phone assistance	0
2470	its ease of use and the top service from apple -  be it their phone assistance or bellying up to the genius bar -  cannot be beat . 	genius bar	0
331	it has a 10 hour battery life when you 're  doing web browsing and word editing ,  making it perfect for the classroom or office ,  and in terms of gaming and movie playing it 'll  have a battery life of just over 5 hours . 	battery life	0
331	it has a 10 hour battery life when you 're  doing web browsing and word editing ,  making it perfect for the classroom or office ,  and in terms of gaming and movie playing it 'll  have a battery life of just over 5 hours . 	battery life	0
331	it has a 10 hour battery life when you 're  doing web browsing and word editing ,  making it perfect for the classroom or office ,  and in terms of gaming and movie playing it 'll  have a battery life of just over 5 hours . 	gaming	2
331	it has a 10 hour battery life when you 're  doing web browsing and word editing ,  making it perfect for the classroom or office ,  and in terms of gaming and movie playing it 'll  have a battery life of just over 5 hours . 	movie playing	2
331	it has a 10 hour battery life when you 're  doing web browsing and word editing ,  making it perfect for the classroom or office ,  and in terms of gaming and movie playing it 'll  have a battery life of just over 5 hours . 	web browsing	2
331	it has a 10 hour battery life when you 're  doing web browsing and word editing ,  making it perfect for the classroom or office ,  and in terms of gaming and movie playing it 'll  have a battery life of just over 5 hours . 	word editing	2
1057	acer has set me up with free recovery discs ,  when they are available since i asked . 	recovery discs	0
1095	i also purchased office max 's   " max assurance "  with the  " no lemon "  clause . 	office max 's " max assurance " 	2
1718	i eventually did the migration from my imac backup disc which uses usb . 	imac backup disc	2
1718	i eventually did the migration from my imac backup disc which uses usb . 	usb	2
2923	the battery life seems to be very good ,  and have had no issues with it . 	battery life	0
3027	enabling the battery timer is useless . 	battery timer	1
654	temperatures on the outside were alright but i did not track in core processing unit temperatures . 	temperatures	2
654	temperatures on the outside were alright but i did not track in core processing unit temperatures . 	core processing unit temperatures	2
1110	going to bring it to service today . 	service	2
1488	there is no need to purchase virus protection for mac ,  which saves me a lot of time and money . 	virus protection for mac	0
488	but we had paid for bluetooth ,  and there was none . 	bluetooth	1
1289	so ,  i paid a visit to lg notebook service center at alexandra road ,  hoping they can make the hinge tighter . 	lg notebook service center	2
1289	so ,  i paid a visit to lg notebook service center at alexandra road ,  hoping they can make the hinge tighter . 	hinge	1
2985	my daughter uses it for games ,  email ,  facebook ,  pictures and music . 	games	2
1573	it is always reliable ,  never bugged and responds well . 	responds	0
1928	after about a week i finally got it back and was told that the motherboard had failed and so they installed a new motherboard . 	motherboard	1
1928	after about a week i finally got it back and was told that the motherboard had failed and so they installed a new motherboard . 	motherboard	2
1099	it was slow ,  locked up ,  and also had hardware replaced after only 2 months ! 	hardware	1
1347	they had to replace the motherboard in april	motherboard	1
1408	yes ,  the computer was light weight ,  less expensive than the average laptop ,  and was pretty self explantory in use . 	use	0
1374	also ,  if you need to talk to a representive at microsoft ,  there is a charge ,  which i believe is robbery ,  since you are charged enormous amounts for a very badly designed system ,  which most people would have went with xp if they could . 	representive at microsoft	1
1374	also ,  if you need to talk to a representive at microsoft ,  there is a charge ,  which i believe is robbery ,  since you are charged enormous amounts for a very badly designed system ,  which most people would have went with xp if they could . 	system	1
1374	also ,  if you need to talk to a representive at microsoft ,  there is a charge ,  which i believe is robbery ,  since you are charged enormous amounts for a very badly designed system ,  which most people would have went with xp if they could . 	xp	0
2864	i love windows 7 which is a vast improvment over vista . 	windows 7	0
2864	i love windows 7 which is a vast improvment over vista . 	vista	1
30	keyboard is great ,  very quiet for all the typing that i do . 	keyboard	0
474	dell 's  customer disservice is an insult to it 's  customers who pay good money for shoddy products . 	dell 's customer disservice	1
156	it had a cooling system malfunction after 10 minutes of general use ,  and would not move past this error . 	cooling system	1
156	it had a cooling system malfunction after 10 minutes of general use ,  and would not move past this error . 	use	2
2095	i can render avchd movies with little effort ,  which was a problem for most pc 's  unless you had a quad core i7 . 	quad core i7	0
1722	after talking it over with the very knowledgeable sales associate ,  i chose the macbook pro over the white macbook . 	sales associate	0
2004	if you really want a bang - up system and do n't  need to run windows applications ,  go with an apple;	system	0
2004	if you really want a bang - up system and do n't  need to run windows applications ,  go with an apple;	windows applications	2
2296	you wo n't  have to spend gobs of money on some inefficient virus program that needs to be updated every month and that constantly drains your wallet . 	virus program	1
493	it weighed like seven pounds or something like that . 	weighed	2
493	it weighed like seven pounds or something like that . 	seven pounds	2
902	2 months later ,  the battery went . 	battery	1
2433	you may need to special order a bag . 	bag	2
1675	it 's  color is even cool . 	color	0
609	keys are all in weird places and is way too large for the way it is designed . 	keys	1
609	keys are all in weird places and is way too large for the way it is designed . 	designed	1
296	yes ,  a mac is much more money than the average laptop out there ,  but there is no comparison in style ,  speed and just cool factor . 	style	0
296	yes ,  a mac is much more money than the average laptop out there ,  but there is no comparison in style ,  speed and just cool factor . 	speed	0
2335	the keyboard feels good and i type just fine on it . 	keyboard	0
2416	i thought the white mac computers looked dirty too quicly where you use the mousepad and where you place your hands when typing . 	mousepad	2
1471	and not to mention after using it for a few months or so ,  the battery will slowly less and less hold a charge until you ca n't  leave it unplugged for more than 5 minutes without the thing dying . 	battery	1
1427	best buy  -  5 stars + + +  ( sales ,  service ,  respect for old men who are n't  familiar with the technology )  dell computers  -  3 stars dell support  -  owes a me a couple	sales	0
1427	best buy  -  5 stars + + +  ( sales ,  service ,  respect for old men who are n't  familiar with the technology )  dell computers  -  3 stars dell support  -  owes a me a couple	service	0
1427	best buy  -  5 stars + + +  ( sales ,  service ,  respect for old men who are n't  familiar with the technology )  dell computers  -  3 stars dell support  -  owes a me a couple	dell support	0
911	no complaints with their desktop ,  and maybe because it just sits on your desktop ,  and you do n't  carry it around ,  which could jar the hard drive ,  or the motherboard . 	hard drive	2
911	no complaints with their desktop ,  and maybe because it just sits on your desktop ,  and you do n't  carry it around ,  which could jar the hard drive ,  or the motherboard . 	motherboard	2
2001	yes ,  they cost more ,  but they more than make up for it in speed ,  construction quality ,  and longevity . 	speed	0
2001	yes ,  they cost more ,  but they more than make up for it in speed ,  construction quality ,  and longevity . 	construction quality	0
2001	yes ,  they cost more ,  but they more than make up for it in speed ,  construction quality ,  and longevity . 	longevity	0
2465	since i keyboard over 100 wpm ,  i look for a unit that has a comfortble keyboard  ( no keys sticking or lagging ,  strange configuration of  " extra key "  ,  etc . 	keyboard	0
2465	since i keyboard over 100 wpm ,  i look for a unit that has a comfortble keyboard  ( no keys sticking or lagging ,  strange configuration of  " extra key "  ,  etc . 	keys	0
2465	since i keyboard over 100 wpm ,  i look for a unit that has a comfortble keyboard  ( no keys sticking or lagging ,  strange configuration of  " extra key "  ,  etc . 	configuration of " extra key " 	0
2331	 )  i also tried the touch pad and compared it to other netbooks in the store . 	touch pad	2
599	it absolutely is more expensive than most pc laptops ,  but the ease of use ,  security ,  and minimal problems that have arisen make it well worth the pricetag . 	use	0
599	it absolutely is more expensive than most pc laptops ,  but the ease of use ,  security ,  and minimal problems that have arisen make it well worth the pricetag . 	security	0
823	it gets stuck all of the time you use it ,  and you have to keep tapping on it to get it to work . 	use	1
823	it gets stuck all of the time you use it ,  and you have to keep tapping on it to get it to work . 	work	1
3006	lots of preloaded software . 	preloaded software	0
2941	i wish it had a webcam though ,  then it would be perfect ! 	webcam	1
2776	my favorite part of this computer is that it has a vga port so i can connect it to a bigger screen . 	vga port	0
2776	my favorite part of this computer is that it has a vga port so i can connect it to a bigger screen . 	screen	2
1686	another thing i might add is the battery life is excellent . 	battery life	0
2091	one drawback ,  i wish the keys were backlit . 	keys	1
1259	acer was no help and garmin could not determine the problem ( after spending about 2 hours with me )  ,  so i returned it and purchased a toshiba r700 that seems even nicer and i was able to load all of my software with no problem . 	software	0
2938	i wish the volume could be louder and the mouse didnt break after only a month . 	volume	1
2938	i wish the volume could be louder and the mouse didnt break after only a month . 	mouse	1
2574	i play a lot of casual games online ,  and the touchpad is very responsive . 	touchpad	0
2351	granted ,  it 's  still a very new laptop but in comparison to my previous laptops and desktops ,  my mac boots up noticeably quicker . 	boots up	0
526	it caught a virus that completely wiped out my hard drive in a matter of hours . 	hard drive	1
3020	it is everything i 'd  hoped it would be from a look and feel standpoint ,  but somehow a bit more sturdy . 	look and feel standpoint	0
