review_id	review_text	aspect_term	polarity
2398	i bought it for my mom and she reports that the battery life lasts all day for her ,  it 's  very lightweight ,  and the response for the computing she 's  doing  ( internet focused activity :  mail ,  research ,  etc .  )  is excellent;	response	0
2398	i bought it for my mom and she reports that the battery life lasts all day for her ,  it 's  very lightweight ,  and the response for the computing she 's  doing  ( internet focused activity :  mail ,  research ,  etc .  )  is excellent;	internet focused activity	2
2581	its very nice and once you learn the features you will be so happy to have such a sophisticated computer . 	features	2
1766	it is sleek and lightweight and charges quickly when needed . 	charges	0
2236	also you may need to charge it once a day ,  if for medium use every thing fast and easy with mac  the size and look is the most feature that attracted me to it . 	size	0
2236	also you may need to charge it once a day ,  if for medium use every thing fast and easy with mac  the size and look is the most feature that attracted me to it . 	look	0
2236	also you may need to charge it once a day ,  if for medium use every thing fast and easy with mac  the size and look is the most feature that attracted me to it . 	feature	0
2236	also you may need to charge it once a day ,  if for medium use every thing fast and easy with mac  the size and look is the most feature that attracted me to it . 	charge	2
1717	 (  the ibook backup also uses a firewire connection )  . 	ibook backup	2
1717	 (  the ibook backup also uses a firewire connection )  . 	firewire connectio	2
2766	i did think it had a camera because that was one of my requirements ,  but forgot to check in the specifications on this one before i purchased . 	camera	2
2766	i did think it had a camera because that was one of my requirements ,  but forgot to check in the specifications on this one before i purchased . 	specifications	2
448	also the display is exceptional ! 	display	0
1225	the computer was shipped to their repair depot on june 24 and returned on july 2 seems like a short turn around time except the computer was not repaired when it was returned . 	repair depot	2
207	learning all of the keyboard shortcuts only took a few minutes to get used to as some of the shortcuts are the same on windows machines . 	keyboard shortcuts	0
207	learning all of the keyboard shortcuts only took a few minutes to get used to as some of the shortcuts are the same on windows machines . 	shortcuts	2
2805	little short on ram but you get what you pay for . 	ram	1
1819	it did n't  come with any software installed outside of windows media ,  but for the price ,  i was very pleased with the condition and the overall product . 	software	1
1819	it did n't  come with any software installed outside of windows media ,  but for the price ,  i was very pleased with the condition and the overall product . 	windows media	2
1819	it did n't  come with any software installed outside of windows media ,  but for the price ,  i was very pleased with the condition and the overall product . 	price	0
904	then ,  one month after the warranty expired ,  the replacement charger went . 	warranty	2
904	then ,  one month after the warranty expired ,  the replacement charger went . 	replacement charger	1
2093	i love a  " pc "  but i was ready for a change and tired of the windows system . 	windows system	1
890	your cursor will end up all over the freaking place ,  ,  , it 's  not uncommon for me to accidentally delete words ,  sentences ,  paragraphs because of this mousepad . 	cursor	1
890	your cursor will end up all over the freaking place ,  ,  , it 's  not uncommon for me to accidentally delete words ,  sentences ,  paragraphs because of this mousepad . 	mousepad	1
722	other installed features ,  such as certain printer software ,  are also most attractive . 	features	0
722	other installed features ,  such as certain printer software ,  are also most attractive . 	printer software	0
575	i work in film editing and post production ,  so i need a laptop that not only has power ,  but memory and speed as well . 	power	2
575	i work in film editing and post production ,  so i need a laptop that not only has power ,  but memory and speed as well . 	memory	2
575	i work in film editing and post production ,  so i need a laptop that not only has power ,  but memory and speed as well . 	speed	2
1310	even doing so ,  the hinge may just be slightly tightened only . 	hinge	2
1570	company provides ups shipping ,  fast ,  great ! 	shipping	0
1020	i would tell the technician i knewexactlywhat was wrong with it but they did not listen and i had to go through a bunch of junk to get them to tell me i needed to send the computer in . 	technician	1
982	then i 've  fixed the dc jack  ( inside the unit )  ,  rewired the dc jack to the outside of the laptop ,  replaced the power brick . 	dc jack	2
982	then i 've  fixed the dc jack  ( inside the unit )  ,  rewired the dc jack to the outside of the laptop ,  replaced the power brick . 	dc jack	2
982	then i 've  fixed the dc jack  ( inside the unit )  ,  rewired the dc jack to the outside of the laptop ,  replaced the power brick . 	power brick	2
1783	it is easy to use ,  has great screen quality ,  and every so light weight . 	screen quality	0
1783	it is easy to use ,  has great screen quality ,  and every so light weight . 	use	0
2090	great product ,  very easy to use and great graphics . 	graphics	0
2090	great product ,  very easy to use and great graphics . 	use	0
597	the ilife software that comes with the computer is so simple to use and produces a great finished product . 	ilife software	0
597	the ilife software that comes with the computer is so simple to use and produces a great finished product . 	use	0
454	the built - in webcam is great for skype and similar video - chat services . 	built - in webcam	0
1321	the shop will definitely push the problem to the service center . 	service center	2
2507	pc users work in word ,  while mac users work in pages . 	word	2
2507	pc users work in word ,  while mac users work in pages . 	pages	2
84	while i mostly use it for email ,  internet and gaming ,  i 'm  confident all other applications live up to the high standard i 've  come to appreciate from mac laptops . 	applications	0
84	while i mostly use it for email ,  internet and gaming ,  i 'm  confident all other applications live up to the high standard i 've  come to appreciate from mac laptops . 	internet	2
84	while i mostly use it for email ,  internet and gaming ,  i 'm  confident all other applications live up to the high standard i 've  come to appreciate from mac laptops . 	gaming	2
834	this laptop looks great on the surface :  17 "  inch screen ,  good  price - point ,  nice appearance ,  boots up quickly ,  runs fast etc . 	17 " inch screen	0
834	this laptop looks great on the surface :  17 "  inch screen ,  good  price - point ,  nice appearance ,  boots up quickly ,  runs fast etc . 	price - point	0
834	this laptop looks great on the surface :  17 "  inch screen ,  good  price - point ,  nice appearance ,  boots up quickly ,  runs fast etc . 	appearance	0
834	this laptop looks great on the surface :  17 "  inch screen ,  good  price - point ,  nice appearance ,  boots up quickly ,  runs fast etc . 	boots up	0
834	this laptop looks great on the surface :  17 "  inch screen ,  good  price - point ,  nice appearance ,  boots up quickly ,  runs fast etc . 	runs	0
1449	the apple systems are over priced luxurys that ar n't  worth what they are being charged for ,  this model 's  specifications are far from being impressive and they only thing you get out of this is the apple name . 	specifications	1
1449	the apple systems are over priced luxurys that ar n't  worth what they are being charged for ,  this model 's  specifications are far from being impressive and they only thing you get out of this is the apple name . 	over priced	1
566	pros :   the macbook pro notebook has a large battery life and you wont have to worry to charge your laptop every five hours or so . 	battery life	0
983	disappointing for such a lovely screen and at a reasonable price	screen	0
983	disappointing for such a lovely screen and at a reasonable price	price	0
2975	the only bad thing about it is they give you the worst batteries possible . 	batteries	1
2684	good price . 	price	0
918	the motherboard is dead  ! 	motherboard	1
2144	the speed is fine . 	speed	0
1361	hmmm  -  that high failure rate sure is n't  reflected in the retail price . 	retail price	1
2784	it was not clear that the microsoft student edition that was loaded on the computer ,  was a six month trial . 	microsoft student edition	1
1805	good for every day computing and web browsing . 	web browsing	0
1805	good for every day computing and web browsing . 	every day computing	0
821	also ,  i have had alot of trouble with the keys sticking and will not type correctly . 	keys	1
441	excellent led monitor and well equipped . 	led monitor	0
1913	this process continued to repeat itself until the mother board had been replaced 4 times and the hard drive replaced 3 times . 	mother board	1
1913	this process continued to repeat itself until the mother board had been replaced 4 times and the hard drive replaced 3 times . 	hard drive	1
1793	without a doubt ,  the  * design *  of this laptop is fantastic . 	design	0
378	i could n't  believe how long the battery lasted on a single charge . 	battery	0
378	i could n't  believe how long the battery lasted on a single charge . 	charge	0
1412	i could save ten essay papers and have hardly any memory left . 	memory	1
2963	other than that ,  i would recommend this to someone in need of a cheap laptop with semi - decent gaming capabilities . 	gaming	0
568	this is the first time that i tried and owning a netbook although i have used 3 different laptops in the past 10 years ,  i find not much difference except of course for the screen size . 	screen size	2
1202	but the biggest pain is that tech support is not available 24 / 7 . 	tech support	1
1491	the backlit keys are wonderful when you are working in the dark . 	backlit keys	0
1171	i chose the ibookg4 ,  a laptop that is an attractive computer with a large screen big enough to please anyone . 	screen	0
1727	the most recent being that my safari internet browser is freaking out on me ,  but i have just been using firefox instead . 	safari internet browser	1
1727	the most recent being that my safari internet browser is freaking out on me ,  but i have just been using firefox instead . 	firefox	0
2503	everything about the mac is not only visually appealing ,  but very easy to use . 	use	0
3031	i know what 7 hrs of battery looks like . 	battery	0
2970	i did not have to call the support line at all . 	support line	2
1483	the laptop is outstanding in all aspects except that it has the windows 7 starter and not the full windows 7 . 	windows 7 starter	1
1483	the laptop is outstanding in all aspects except that it has the windows 7 starter and not the full windows 7 . 	windows 7	0
1084	the first problem is that the keyboard function is simply unsatisfactory . 	keyboard function	1
120	the dvd drive randomly pops open when it is in my backpack as well ,  which is annoying . 	dvd drive	1
1658	garageband is more for the musicians ,  and the laptop is equipped with a good working microphone ,  good enough for beginners and musicians at the intermediate level . 	garageband	2
1658	garageband is more for the musicians ,  and the laptop is equipped with a good working microphone ,  good enough for beginners and musicians at the intermediate level . 	microphone	0
3004	i dual boot with linux and that other security - prone os and it performs flawlessly . 	linux	2
3004	i dual boot with linux and that other security - prone os and it performs flawlessly . 	security - prone os	2
3004	i dual boot with linux and that other security - prone os and it performs flawlessly . 	performs	0
2894	the difference is the toshiba had a lot more memory and hard drive space . 	memory	0
2894	the difference is the toshiba had a lot more memory and hard drive space . 	hard drive space	0
1716	there was a little difficulty doing the migration as the firewire cable system ca n't  be used with the ibook . 	firewire cable system	1
1716	there was a little difficulty doing the migration as the firewire cable system ca n't  be used with the ibook . 	ibook	2
2734	seems like maybe a bad shipment from toshiba . 	shipment	1
2315	os x is solid with lots of innovations such as quicklook which save heaps of time . 	os x	0
2315	os x is solid with lots of innovations such as quicklook which save heaps of time . 	quicklook	0
1567	but other than that i am blown away by all the features this laptop offers . 	features	0
387	the keyboard is slick and quiet and not bulky like some other laptops i have had in the past . 	keyboard	0
8	overall ,  this laptop is definitely a keeper with its simple yet stylish design and its array of fantastic colors to choose from . 	design	0
8	overall ,  this laptop is definitely a keeper with its simple yet stylish design and its array of fantastic colors to choose from . 	colors	0
403	first the screen goes completely out . 	screen	1
2350	i 'm  learning the finger options for the mousepad that allow for quicker browsing of web pages . 	mousepad	0
2350	i 'm  learning the finger options for the mousepad that allow for quicker browsing of web pages . 	browsing	0
1497	the photobooth is a great program ,  it takes very good pictures with the built - in camera . 	photobooth	0
1497	the photobooth is a great program ,  it takes very good pictures with the built - in camera . 	program	0
1497	the photobooth is a great program ,  it takes very good pictures with the built - in camera . 	built - in camera	0
280	many kinds of software that is necessary to the working person is not available and cannot be downloaded . 	software	1
1012	i had to pay for the shipping ! 	shipping	1
657	it bluescreened on me without any warning ,  running simply basic chrome . 	chrome	1
2764	i took 3 - 4 years researching brands and prices of laptops . 	prices	2
2149	we researched and found the best price at macconnection . 	price	0
926	but guess what ?    ( you have to buy an external dvd drive it does n't  have a built in type )  the notebook ca n't  be used because it does n't  read anything for an external drive . 	external dvd drive	1
926	but guess what ?    ( you have to buy an external dvd drive it does n't  have a built in type )  the notebook ca n't  be used because it does n't  read anything for an external drive . 	external drive	1
682	get this computer for portability and fast processing !  !  ! 	portability	0
682	get this computer for portability and fast processing !  !  ! 	processing	0
871	i use a cooling pad but it does n't  help . 	cooling pad	1
1744	supplied software :  the software that comes with this machine is greatly welcomed compared to what windows comes with . 	supplied software	2
1744	supplied software :  the software that comes with this machine is greatly welcomed compared to what windows comes with . 	software	0
1744	supplied software :  the software that comes with this machine is greatly welcomed compared to what windows comes with . 	windows	1
773	i 'm  tired of the inept service . 	service	1
1659	garageband is easy to work with ,  like all the other apple applications i 've  had experience with . 	garageband	0
1659	garageband is easy to work with ,  like all the other apple applications i 've  had experience with . 	apple applications	0
746	no ,  tey do n't  even support their own bios and it  " could be a problem with the bios "  how can a company that makes a fairly decent product get away with such insanity ?  ?  !  ! 	bios	1
746	no ,  tey do n't  even support their own bios and it  " could be a problem with the bios "  how can a company that makes a fairly decent product get away with such insanity ?  ?  !  ! 	bios	1
1358	because we did not purchase the extended warranty in time ,  we are on the hook for the repair . 	extended warranty	1
108	it started out by randomly ceasing to charge when it was plugged in  ( mousing over the battery icon would read ,  for example ,   " 74% ,  plugged in ,  not charging "  )  ,  requiring me to unplug it and plug it back in several times to get it to charge . 	charging	1
108	it started out by randomly ceasing to charge when it was plugged in  ( mousing over the battery icon would read ,  for example ,   " 74% ,  plugged in ,  not charging "  )  ,  requiring me to unplug it and plug it back in several times to get it to charge . 	charge	1
108	it started out by randomly ceasing to charge when it was plugged in  ( mousing over the battery icon would read ,  for example ,   " 74% ,  plugged in ,  not charging "  )  ,  requiring me to unplug it and plug it back in several times to get it to charge . 	charge	2
1818	this laptop looked brand new and was shipped very quickly . 	shipped	0
1112	info :  windows failed to load because the kernal is missing ,  or corrupt . 	windows	1
1112	info :  windows failed to load because the kernal is missing ,  or corrupt . 	kernal	1
1576	the display on this computer is the best i 've  seen in a very long time ,  the battery life is very long and very convienent . 	display	0
1576	the display on this computer is the best i 've  seen in a very long time ,  the battery life is very long and very convienent . 	battery life	0
1409	but the quality ,  in general was less than the worth of the cheap laptop . 	quality	1
458	in the first moth of owning this computer its hardrive failed which had to be replaced . 	hardrive	1
1530	its also fun to use ! 	use	0
1612	the graphics and screen are stunning and although i was a pc person ,  i was able to understand how to use a mac fairly quickly . 	graphics	0
1612	the graphics and screen are stunning and although i was a pc person ,  i was able to understand how to use a mac fairly quickly . 	screen	0
2273	with the upgraded memory ,  the macbook pro never has an issue running many many applications at once ! 	upgraded memory	0
2273	with the upgraded memory ,  the macbook pro never has an issue running many many applications at once ! 	applications	2
2273	with the upgraded memory ,  the macbook pro never has an issue running many many applications at once ! 	running	0
2824	simple to use ,  and great graphics . 	graphics	0
2824	simple to use ,  and great graphics . 	use	0
2934	the internet speed is spectacular . 	internet speed	0
624	they claim call center is still down . 	call center	1
2408	mac also has many apps and programs that are quite cheap or free . 	apps	0
2408	mac also has many apps and programs that are quite cheap or free . 	programs	0
2984	my husband uses it mostly for games ,  email and music . 	games	2
2565	i just took the broken cords into the apple store and they gave me new ones . 	cords	0
909	apparently under the screen there are 2 little screws and when the screen gets moved back and forth ,  they come loose . 	screen	2
909	apparently under the screen there are 2 little screws and when the screen gets moved back and forth ,  they come loose . 	screen	2
2347	being a pc user my whole life ,  it 's  taking a bit of time to adapt to the os of a mac but i 'm  finding my way around . 	os	2
1470	the computer will constantly be getting hot and burning your leg unless you go through the hassle of taking off the entire back of it just to clean out the fan . 	fan	1
1601	i have in the past gotten superfine sandpaper and  " fixed "  the edges by rounding them off . 	edges	1
1747	downfalls :  sharp edges . 	edges	1
2537	i needed one to be able to carry to work everyday and this one seems to fit all of the criteria . 	carry	2
2322	the screen is gorgeous  -  yummy good . 	screen	0
1129	did i mention everything about it ,  from size to weight to keyboard screams bulk ? 	size	1
1129	did i mention everything about it ,  from size to weight to keyboard screams bulk ? 	weight	1
1129	did i mention everything about it ,  from size to weight to keyboard screams bulk ? 	keyboard	1
941	i had it four months when my disc drive refused to open . 	disc drive	1
1154	so ,  after apple replaced the hard drive i enjoyed another 4 months of my new computer ,  until it froze this morning -  - completely . 	hard drive	2
1201	once again ,  i was told it was the suspicious  power supply  problem . 	power supply	1
1558	the macbook starts fast ,  does n't  crash ,  has a fantastic display ,  is small and light  ( i have the 13 . 3 "  model )  ,  and is n't  always complaining about updates ,  lost connections ,  errors ,  blue screens ,  etc . 	display	0
1558	the macbook starts fast ,  does n't  crash ,  has a fantastic display ,  is small and light  ( i have the 13 . 3 "  model )  ,  and is n't  always complaining about updates ,  lost connections ,  errors ,  blue screens ,  etc . 	starts	0
462	unable to boot up this brand new laptop . 	boot up	1
2248	in addition ,  all the design tools on pages and keynotes makes it much easier to create professional looking documents and presentations . 	pages	0
2248	in addition ,  all the design tools on pages and keynotes makes it much easier to create professional looking documents and presentations . 	keynotes	0
1097	i actually had the hard drive replaced twice ,  the mother board once ,  the dvd drive twice ,  then they finally agreed to replace it ,   ( all of this in less than 1 1 / 2 years ! 	hard drive	1
1097	i actually had the hard drive replaced twice ,  the mother board once ,  the dvd drive twice ,  then they finally agreed to replace it ,   ( all of this in less than 1 1 / 2 years ! 	mother board	1
1097	i actually had the hard drive replaced twice ,  the mother board once ,  the dvd drive twice ,  then they finally agreed to replace it ,   ( all of this in less than 1 1 / 2 years ! 	dvd drive	1
1308	the guy then said that if i insist on having the hinge tightened ,  they can do it for me but i have to accept the condition after the  " repair "  . 	hinge	2
838	the port is secured to motherboard so when this  happens you ca n't  see the plug at all ,  it 's  just gone . 	motherboard	2
838	the port is secured to motherboard so when this  happens you ca n't  see the plug at all ,  it 's  just gone . 	port	2
838	the port is secured to motherboard so when this  happens you ca n't  see the plug at all ,  it 's  just gone . 	plug	1
2477	i love the feel of the key board ,  as well as the trackpad . 	key board	0
2477	i love the feel of the key board ,  as well as the trackpad . 	trackpad	0
2226	now i have the best of both worlds with all of the power and ease of the mac ! 	power	0
2226	now i have the best of both worlds with all of the power and ease of the mac ! 	ease	0
670	ease of use is just one of the benefits i love about my mac . 	use	0
1051	 - touchpad will take a bit of time to get used to . 	touchpad	2
1216	now the machine wo n't  connect and toshiba says that they did replace the connection card in may but they only warranty the repair for 30 days and now i 'm  out of warranty even though this has been a constant 5 month occurance since i bought the netbook . 	connection card	2
1216	now the machine wo n't  connect and toshiba says that they did replace the connection card in may but they only warranty the repair for 30 days and now i 'm  out of warranty even though this has been a constant 5 month occurance since i bought the netbook . 	warranty	1
1216	now the machine wo n't  connect and toshiba says that they did replace the connection card in may but they only warranty the repair for 30 days and now i 'm  out of warranty even though this has been a constant 5 month occurance since i bought the netbook . 	warranty	1
1074	but ,  buy this model and just purchase 4gb of ram  ( 2x2gb for $92 or 1x4gb for $99 )  ,  and save yourself $100 than the other model with 8gb of ram . 	4gb of ram	2
1074	but ,  buy this model and just purchase 4gb of ram  ( 2x2gb for $92 or 1x4gb for $99 )  ,  and save yourself $100 than the other model with 8gb of ram . 	8gb of ram	2
2401	if you 're  looking for something to fly through those massive spreadsheets or play a graphics - intensive game ,  you 'd  be better off getting a machine aimed at that segment of the market . 	game	2
1684	browsing ,  also ,  was no problem for me when i used itunes  (  which usually slows down my pc  )  . 	browsing	0
1684	browsing ,  also ,  was no problem for me when i used itunes  (  which usually slows down my pc  )  . 	itunes	0
2680	again ,  decent comp for the price ,  and i was in need of one quickly as my other laptop died on me . 	price	0
1401	so in a brief summary i would have to say that i would not recommend dell vostro 1000 to anyone due to it being a down right awful setup so in my opinion you should steer clear of them if you want a decent laptop . 	setup	1
1803	my friend just had to replace his entire motherboard ,  so did my wife ,  and it looks like i will have to as well . 	motherboard	1
1140	toshiba customer services will indirectly deal with your problems by constantly tranferring you from one country to another ,  and i am not kidding you ,  i called different hours of the day and you 'll  get someone else from another country trying to get you to tell them your life story all over again ,  since they make it sound like they do n't  have your history list of your calls right in front of them . 	toshiba customer services	1
2143	quality display  i was surprised with the performance and quality of this hp laptop . 	quality display	0
2143	quality display  i was surprised with the performance and quality of this hp laptop . 	performance	0
2143	quality display  i was surprised with the performance and quality of this hp laptop . 	quality	0
1778	the battery life also does n't  keep up with the claim but still i think macbook is much ahead from the rest of the pack . 	battery life	1
